{
  "library_id": "yarafie",
  "blueprint_id": "ikea_e2001_e2002",
  "releases": ["anything"],
  "description": "Controller blueprint library for ikea_e2001_e2002 maintained by yarafie.",
  "supported_integrations": ["Zigbee2MQTT"],
  "category": "controller",
  "status": "active",
  "title": "yarafie controller library",
  "maintainers": [
    {
      "id": "yarafie",
      "name": "yarafie"
    }
  ]
}
