{
  "library_id": "EPMatt",
  "blueprint_id": "smarthjemmet_dk_quad_zig_sw",
  "releases": ["awesome"],
  "description": "Controller blueprint library for smarthjemmet_dk_quad_zig_sw maintained by EPMatt.",
  "supported_integrations": ["Zigbee2MQTT"],
  "category": "controller",
  "status": "active",
  "title": "EPMatt controller library",
  "maintainers": [
    {
      "id": "EPMatt",
      "name": "EPMatt"
    }
  ]
}
