{
  "library_id": "EPMatt",
  "blueprint_id": "ikea_e2201",
  "releases": ["awesome"],
  "description": "Controller blueprint library for ikea_e2201 maintained by EPMatt.",
  "supported_integrations": ["ZHA", "Zigbee2MQTT", "deCONZ"],
  "category": "controller",
  "status": "active",
  "title": "EPMatt controller library",
  "maintainers": [
    {
      "id": "EPMatt",
      "name": "EPMatt"
    }
  ]
}
