{
  "library_id": "EPMatt",
  "blueprint_id": "philips_929002398602",
  "releases": ["awesome"],
  "description": "Controller blueprint library for philips_929002398602 maintained by EPMatt.",
  "supported_integrations": ["ZHA", "Zigbee2MQTT"],
  "category": "controller",
  "status": "active",
  "title": "EPMatt controller library",
  "maintainers": [
    {
      "id": "EPMatt",
      "name": "EPMatt"
    }
  ]
}
