{
  "library_id": "EPMatt",
  "blueprint_id": "shelly_button_1",
  "releases": ["awesome"],
  "description": "Controller blueprint library for shelly_button_1 maintained by EPMatt.",
  "supported_integrations": ["Shelly"],
  "category": "controller",
  "status": "active",
  "title": "EPMatt controller library",
  "maintainers": [
    {
      "id": "EPMatt",
      "name": "EPMatt"
    }
  ]
}
