{
  "library_id": "EPMatt",
  "blueprint_id": "xiaomi_wxcjkg13lm",
  "releases": ["awesome"],
  "description": "Controller blueprint library for xiaomi_wxcjkg13lm maintained by EPMatt.",
  "supported_integrations": ["ZHA", "Zigbee2MQTT", "deCONZ"],
  "category": "controller",
  "status": "active",
  "title": "EPMatt controller library",
  "maintainers": [
    {
      "id": "EPMatt",
      "name": "EPMatt"
    }
  ]
}
