{
  "library_id": "EPMatt",
  "blueprint_id": "cover",
  "releases": ["awesome"],
  "description": "Hook blueprint library for cover maintained by EPMatt.",
  "supported_integrations": [],
  "category": "hook",
  "status": "active",
  "title": "EPMatt hook library for cover",
  "maintainers": [
    {
      "id": "EPMatt",
      "name": "EPMatt"
    }
  ]
}
