{
  "library_id": "EPMatt",
  "blueprint_id": "simple_safe_scheduler",
  "releases": ["awesome"],
  "description": "Automation blueprint library for simple_safe_scheduler maintained by EPMatt.",
  "supported_integrations": [],
  "category": "automation",
  "status": "active",
  "title": "EPMatt automation library for simple_safe_scheduler",
  "maintainers": [
    {
      "id": "EPMatt",
      "name": "EPMatt"
    }
  ]
}
